{
  "schema": 1,
  "id": "place_value_inquiry",
  "title": "进位制的认识与探究",
  "stage": "junior",
  "outline_refs": [
    {
      "book_id": "七上",
      "title": "综合与实践 进位制的认识与探究"
    }
  ],
  "standard_ids": [
    "cms-2022:4.NA.03",
    "cms-2022:4.NA.04"
  ],
  "standard_alignment_note": "关联乘方、代数式和用字母表示规律；进位制作为目录综合实践项目独立组织，不能据此声称完整覆盖两个课标条款。",
  "duration_hint": "3 课时，每课时约 40 分钟；对应目录项目的 3 课时安排。",
  "task_brief": "设计一种便于别人检查的“每满 b 个换成上一位”的记数方法，用分组、数位表和算式表示同一个数量。探究二进制与五进制，解释为什么不能把 101₂ 读成十进制的一百零一。最终写一份说明，供没参加活动的同学把十进制数与另一进制互相转换。这里 b 是不小于 2 的整数，数码为 0 到 b−1，除表示 0 外最高位不写 0。",
  "objectives": [
    {
      "id": "place_value_inquiry:o1",
      "statement": "能按给定进位规则分组，说明相邻数位的位值关系及数码范围。"
    },
    {
      "id": "place_value_inquiry:o2",
      "statement": "能用分组或商余过程完成十进制与二进制、五进制的互换，并反向验算。"
    },
    {
      "id": "place_value_inquiry:o3",
      "statement": "能用幂与字母说明三位 b 进制数的取值范围，并区分数的大小与表示它的符号。"
    }
  ],
  "materials": [
    "至少 30 个小物件或画出的计数点",
    "标有 1、b、b²、b³、b⁴ 并能继续扩展的数位表，纸、笔、直尺",
    "可用计算器核算幂与加法；说明过程仍需由学生完成"
  ],
  "steps": [
    {
      "title": "亲手建立进位规则",
      "objective_ids": [
        "place_value_inquiry:o1"
      ],
      "instructions": "分别按每满 2 个和每满 5 个换一组的方法整理 18 个计数物。将每一位剩余组数填入数位表，解释为什么数码不能达到进位底数。记录同一个 18 在两种规则下的写法。",
      "deliverable": "两张分组图、数位表和关于数码范围的说明。",
      "family_id": "base-n.grouping-digit-range",
      "variant_id": "place_value_inquiry:step-0-v6",
      "representation": "verbal",
      "cognitive_demand": "execute",
      "alignment_note": "观察每满b进一位和每位余数小于b，不把底数当合法数码。"
    },
    {
      "title": "给别人一份可复查的转换说明",
      "objective_ids": [
        "place_value_inquiry:o1",
        "place_value_inquiry:o2"
      ],
      "instructions": "用分组或连续除法把十进制 23 改写成二进制和五进制。每个结果都用“数码×位值再相加”的方式转回十进制，检查是否仍为 23。再把 101₂ 和 101₅ 分别转为十进制并比较，说明相同数码串为什么代表不同的数。",
      "deliverable": "两组双向转换、反向验算和底数标记。",
      "family_id": "base-n.convert-positional-expansion",
      "variant_id": "place_value_inquiry:step-1-v6",
      "representation": "verbal",
      "cognitive_demand": "execute",
      "alignment_note": "观察十进制23的双向转换及101在不同底数中的位值，不只写终值。"
    },
    {
      "title": "从具体底数推广",
      "objective_ids": [
        "place_value_inquiry:o3"
      ],
      "instructions": "对于任意整数 b≥2，写出最小和最大的三位 b 进制数及对应十进制值。解释最高位不能为 0、每位最大数码为何是 b−1，展开并化简最大值。用 b=2 和 b=5 检查通式。",
      "deliverable": "三位数范围的式子、推导与两个特殊情形检验。",
      "family_id": "base-n.three-digit-general-bounds",
      "variant_id": "place_value_inquiry:step-2-v6",
      "representation": "symbolic",
      "cognitive_demand": "prove",
      "alignment_note": "观察最高位非0、各数码最大b−1，推导b²至b³−1的一般范围。"
    },
    {
      "title": "诊断一份错误说明",
      "objective_ids": [
        "place_value_inquiry:o1",
        "place_value_inquiry:o2",
        "place_value_inquiry:o3"
      ],
      "instructions": "有人写“12₂ 是合法二进制数”“101₂ 比 99₁₀ 大，因为 101 大于 99”“有三个数码就一定是三位数，001₂ 也算”。逐条说明错误在哪里，并修改成有条件、可检验的正确说法。",
      "deliverable": "三条反例订正及面向同学的最终说明页。",
      "family_id": "base-n.representation-versus-value.errors",
      "variant_id": "place_value_inquiry:step-3-v6",
      "representation": "verbal",
      "cognitive_demand": "explain",
      "alignment_note": "观察非法数码、跨进制比较和前导零三个不同错误的具体订正。"
    }
  ],
  "deliverables": [
    "分组与数位表",
    "转换步骤及反向验算",
    "一般规律推导、反例订正和使用说明"
  ],
  "rubric": [
    {
      "objective_ids": [
        "place_value_inquiry:o1"
      ],
      "criterion": "位值、进位规则及合法数码范围对应一致，写明底数。",
      "points": 2,
      "example": "二进制各位值依次为 1、2、4、8、16；18₁₀=10010₂，18₁₀=33₅。"
    },
    {
      "objective_ids": [
        "place_value_inquiry:o2"
      ],
      "criterion": "转换正确且有能独立核对的展开或反向验算，不只写结果。",
      "points": 2,
      "example": "23₁₀=10111₂=43₅；101₂=5₁₀，101₅=26₁₀。"
    },
    {
      "objective_ids": [
        "place_value_inquiry:o3"
      ],
      "criterion": "给出一般范围并说明数码条件，能纠正混淆数值与表示方式的错误。",
      "points": 2,
      "example": "最小三位数为 100_b，即 b²；最大为三个数码 b−1，值 (b−1)b²+(b−1)b+(b−1)=b³−1。"
    }
  ],
  "teacher_notes": [
    "下标表示底数，不是乘法或幂；学生可写“(101)₂”或“二进制 101”避免书写歧义。",
    "三位数的最大值为 b³−1，范围按数值写为 b²≤N≤b³−1；不是说每个底数都能使用十进制数码 9。",
    "先让学生验证具体转换，再要求一般性解释；抽象表达困难可先用二进制、五进制数位表建立规律。",
    "目标o1：若出现12₂，先用两枚单位物交换成一组，个位最多剩1；将18按16、8、4、2、1分成10010₂，按25、5、1分成33₅。",
    "目标o2：若余数顺序倒置，先展开候选数逐位核验；23=16+4+2+1=10111₂，也等于4×5+3=43₅。对101₂与101₅分别算4+1与25+1。",
    "目标o3：若把001算三位数，先指出最高有效位；最小三位数100_b=b²，最大三位值=(b−1)(b²+b+1)=b³−1。用b=2得4至7、b=5得25至124检查。"
  ],
  "assessment_note": "人工审核转换过程、一般推理和反例；正确终值不能替代过程目标。 每项 0 分表示尚未展示，1 分表示部分展示或关键条件缺失，2 分表示有完整且正确的作品证据；评分须附具体反馈。 开放作品观察分组、双向转换与一般条件的推理；正确某个数码串不替代转换过程，尝试两个底数也不代替b≥2的一般推导。",
  "review_status": "draft",
  "author_type": "ai",
  "teacher_review": {
    "status": "pending"
  },
  "provenance": {
    "kind": "original_activity",
    "outline_used_for": "title_and_navigation",
    "textbook_text_reproduced": false
  },
  "teacher_reference_solution": {
    "scenario": "按任务给定的18、23以及一般底数b≥2，均为整数。",
    "steps": [
      "18=1×16+0×8+0×4+1×2+0=10010₂；18=3×5+3=33₅。",
      "23=16+4+2+1=10111₂；23=4×5+3=43₅。101₂=4+1=5，101₅=25+1=26。",
      "三位数最高位至少1，所以最小100_b=b²。每位最多b−1，所以最大(b−1)b²+(b−1)b+(b−1)=b³−1。",
      "12₂含非法数码2；跨进制比较应先求数值；001₂的前导零不增加有效位数，表示一位数1。"
    ],
    "conclusion": "分组、位值展开和反向检验一致，才能确认表示的是同一个量；一般范围依赖整数底数b≥2与无前导零的约定。"
  }
}
