{
  "schema": 1,
  "id": "junior_music_ratios",
  "title": "综合与实践 音乐与数学",
  "stage": "junior",
  "outline_refs": [
    {
      "book_id": "八上",
      "title": "综合与实践 音乐与数学"
    }
  ],
  "standard_ids": [
    "cms-2022:4.NA.04",
    "cms-2022:4.NA.10",
    "cms-2022:4.NA.14"
  ],
  "standard_alignment_note": "仅用目录原题名定位；下列情境、数据、步骤与评价材料为原创。课标关联为作者按活动涉及的数学内容所作映射，未标作教师审定。",
  "task_brief": "研究同种弦、张力不变的简化模型fL=14400，其中有效弦长L以厘米计，频率f以赫兹计。以L=60厘米、f=240赫兹为基准，把频率比2:1标为高八度、3:2标为纯五度、4:3标为纯四度，计算对应弦长并作比例纸条。可用教师提供的对应音频听辨，但数学结论来自模型；不把本模型说成全部乐器或全部调律法。",
  "duration_hint": "3课时，每课时约40分钟；允许分组测量、计算与交流各占一课时。",
  "objectives": [
    {
      "id": "junior_music_ratios:o1",
      "statement": "能把给定频率比转为具体频率与弦长，保持比例方向一致。"
    },
    {
      "id": "junior_music_ratios:o2",
      "statement": "能用f=14400/L解释频率与有效弦长的反比关系，计算并核验表格。"
    },
    {
      "id": "junior_music_ratios:o3",
      "statement": "能区分模型预测、音频听辨与实测证据，说明改变张力或材料后须重新确定关系。"
    }
  ],
  "materials": [
    "直尺、60厘米纸条或按统一比例缩小的纸条",
    "给定fL=14400模型及频率比表",
    "可选教师准备的240、320、360、480赫兹音频"
  ],
  "steps": [
    {
      "title": "建立基准表",
      "objective_ids": [
        "junior_music_ratios:o1"
      ],
      "instructions": "先验60×240=14400，再分别把240乘2、3/2、4/3得到目标频率。每一比值都注明目标音频率比基准频率。",
      "deliverable": "四行频率与比值表。",
      "family_id": "ratio.frequency.target-to-baseline",
      "variant_id": "junior_music_ratios:step-0-v6",
      "representation": "verbal",
      "cognitive_demand": "execute",
      "alignment_note": "观察目标频率比基准的有向比例与赫兹单位。"
    },
    {
      "title": "求弦长并制作比例条",
      "objective_ids": [
        "junior_music_ratios:o1",
        "junior_music_ratios:o2"
      ],
      "instructions": "使用L=14400/f求弦长，或把60除以频率倍数；画对应长度纸条，逐行验算fL。",
      "deliverable": "标有频率、长度与乘积的比例条。",
      "family_id": "inverse-function.string-length.constant-product",
      "variant_id": "junior_music_ratios:step-1-v6",
      "representation": "verbal",
      "cognitive_demand": "execute",
      "alignment_note": "观察频率增倍时长度除以同倍，纸条与fL检验一致。"
    },
    {
      "title": "检查反比而非差值",
      "objective_ids": [
        "junior_music_ratios:o2"
      ],
      "instructions": "比较把弦长从60减到40与从40减到30时，频率分别增加多少；解释同减长度或同增频率不代表固定差。",
      "deliverable": "两段变化计算和反比关系说明。",
      "family_id": "inverse-function.equal-output-change.unequal-input-change",
      "variant_id": "junior_music_ratios:step-2-v6",
      "representation": "verbal",
      "cognitive_demand": "explain",
      "alignment_note": "观察两段频率增120但长度减20与10，反驳固定差或线性规则。"
    },
    {
      "title": "评价模型与证据",
      "objective_ids": [
        "junior_music_ratios:o3"
      ],
      "instructions": "区分“按公式算出”“听到音高改变”“实际测得频率”三类记录。提出改变张力后重复测量的方案，明确旧常数14400不能直接沿用。",
      "deliverable": "带证据类型标签的小报告。",
      "family_id": "model.prediction-audio-measurement-distinction",
      "variant_id": "junior_music_ratios:step-3-v6",
      "representation": "verbal",
      "cognitive_demand": "explain",
      "alignment_note": "观察模型计算、听辨、实测三种证据分开，改张力后须重新检验常数。"
    }
  ],
  "deliverables": [
    "频率—弦长比例表和纸条",
    "恒定乘积与非恒定差值计算",
    "模型前提及证据类型说明"
  ],
  "rubric": [
    {
      "objective_ids": [
        "junior_music_ratios:o1"
      ],
      "criterion": "比值方向和单位正确，频率增加时弦长减少。",
      "points": 2,
      "example": "目标频率分别480、360、320赫兹，对应长度30、40、45厘米。"
    },
    {
      "objective_ids": [
        "junior_music_ratios:o2"
      ],
      "criterion": "表格逐行满足恒定乘积并能解释非线性差值。",
      "points": 2,
      "example": "60→40时240→360增120；40→30时360→480再增120，但长度变化20与10不同。"
    },
    {
      "objective_ids": [
        "junior_music_ratios:o3"
      ],
      "criterion": "明确这是假定同材质同张力的模型，未把听辨当精密测量。",
      "points": 2,
      "example": "改变张力后应重新测若干f、L并检验乘积，不能宣称旧公式仍精确。"
    }
  ],
  "teacher_reference_solution": {
    "scenario": "fL=14400，基准240赫兹、60厘米。",
    "steps": [
      "高八度f=480，L=30；纯五度f=360，L=40；纯四度f=320，L=45。",
      "各行乘积均为14400，所以频率倍数与长度倍数互为倒数。",
      "相同频率增量120可对应不同长度减少量20、10，这与反比模型相符，不是一次函数。"
    ],
    "conclusion": "在给定模型内，短弦对应高频；公式和音程比不自动代表所有真实乐器的测量结果。"
  },
  "teacher_notes": [
    "本任务纯五度、纯四度采用指定简单整数比，不将其与所有调律体系等同。",
    "八上学生可按分式与比例完成；“反比例函数”的正式名称可留待九上回访。",
    "目标o1：若频率比3:2时反算成160Hz，先写目标/240=3/2，得360；标清比的方向再处理2与4/3。",
    "目标o2：若频率升高而弦长也乘倍数，代入fL检查是否仍14400；360×40、480×30、320×45均需相等。",
    "目标o3：若仅“听起来更高”就写测得360Hz，给记录分别加计算、听辨、测量标签；改变张力后用多组f、L重测乘积，不继承旧常数。"
  ],
  "assessment_note": "每项目标依据相应作品独立评分：0分为未展示或关键结论错误，1分为部分正确但缺条件、依据或核对，2分为完整正确且可复核。共6分；反馈指出具体证据，不把参加活动或排版漂亮当作目标达成。 使用给定同弦同张力的简化恒乘积模型，不承诺全部乐器或调律都符合。听辨结果不能代替数值频率实测。",
  "review_status": "draft",
  "author_type": "ai",
  "teacher_review": {
    "status": "pending"
  },
  "provenance": {
    "kind": "original_activity",
    "outline_used_for": "title_and_navigation",
    "textbook_text_reproduced": false
  }
}
