{
  "schema": 1,
  "id": "treasure_map",
  "title": "寻找宝藏",
  "stage": "primary",
  "outline_refs": [
    {
      "book_id": "四上",
      "title": "寻找宝藏"
    }
  ],
  "standard_ids": [
    "cms-2022:2.GE.01",
    "cms-2022:2.GE.02",
    "cms-2022:2.GE.03"
  ],
  "standard_alignment_note": "依据目录活动题名原创设计，关联所列课标中的数量关系、测量或表达要求；不是教材原文复制，也不代表完整覆盖相应课标条款。",
  "duration_hint": "建议2课时：画图给指令、交换地图检验；均可在纸上完成。",
  "task_brief": "在方格纸上设计一张可复现的校园寻宝图。标北向上、东向右，每格边长代表10米；以左下角为起点O。先完成给定路线：从O向东4格、向北3格、向西1格，藏宝点在O向东3格且向北3格的位置。再设计一条不同但到达同一点的路线，并为同伴写出不依赖“我左手边”的地图指令。这里“东3格、北3格”表示图上的两个方向位移，不提前要求形式坐标知识。",
  "objectives": [
    {
      "id": "treasure_map:o1",
      "statement": "能在明确参照点和方向的方格图上正确表示位置与路线。"
    },
    {
      "id": "treasure_map:o2",
      "statement": "能按比例把格数换成实际长度，区分路程与起终点位置。"
    },
    {
      "id": "treasure_map:o3",
      "statement": "能设计并检验有充分信息的路线指令，修正方向或尺度歧义。"
    }
  ],
  "materials": [
    "方格纸、直尺、铅笔与橡皮",
    "北向标记和每格10米的比例说明",
    "两种颜色的路线线条与同伴反馈表"
  ],
  "steps": [
    {
      "title": "建立共用地图",
      "objective_ids": [
        "treasure_map:o1"
      ],
      "instructions": "画至少6×6格网，左下标O，北向上、东向右，写每格10米。将校门设在O，不给真实家庭住址。标出图上向东2格、北1格的位置P，并让同伴复述。",
      "deliverable": "带起点、方向、比例尺和点P的底图。"
    },
    {
      "title": "追踪给定路线",
      "objective_ids": [
        "treasure_map:o1",
        "treasure_map:o2"
      ],
      "instructions": "逐段画向东4格、向北3格、向西1格的路线，每段标方向和格数。用另一颜色从O向东3格再向北3格，验证到达同一点，但路程不同。",
      "deliverable": "两条终点相同、分段标注完整的路线图。"
    },
    {
      "title": "比较走法",
      "objective_ids": [
        "treasure_map:o2"
      ],
      "instructions": "分别求两条路线总格数与米数。说明“最后向西1格”能抵消东西方向的1格位移，却仍计入实际走过路程。若只准沿网格向东/向北走到藏宝点，找一条最短路线并解释至少要走几格。",
      "deliverable": "路程计算和最短路线的必要步数说明。"
    },
    {
      "title": "交换寻宝指令",
      "objective_ids": [
        "treasure_map:o1",
        "treasure_map:o3"
      ],
      "instructions": "自己选一个新的藏宝点，写只含起点、方向、格数的指令，不先展示终点。请同伴按图走；记录误解后修改，尤其不能只写“右转”却不写初始朝向。",
      "deliverable": "可复现的新指令、同伴走法及修订说明。"
    }
  ],
  "deliverables": [
    "带起点、方向、比例尺和点P的底图。",
    "两条终点相同、分段标注完整的路线图。",
    "路程计算和最短路线的必要步数说明。",
    "可复现的新指令、同伴走法及修订说明。"
  ],
  "rubric": [
    {
      "objective_ids": [
        "treasure_map:o1"
      ],
      "criterion": "参照点、方向和位置一致，路线可复现。",
      "points": 2,
      "example": "P在O东2北1格；给定路线终点在东3北3格，不因操作者面朝方向而改变。"
    },
    {
      "objective_ids": [
        "treasure_map:o2"
      ],
      "criterion": "正确区分路程与方向位移，单位转换一致。",
      "points": 3,
      "example": "原路线4+3+1=8格即80米；另一条3+3=6格即60米。网格路线至少东向净3格、北向净3格，共6格可达。"
    },
    {
      "objective_ids": [
        "treasure_map:o3"
      ],
      "criterion": "指令充分且能依据反馈消除具体歧义。",
      "points": 2,
      "example": "把“向右走两格”改为“从O向东两格”；若保留左右转，须同时给初始面向并逐段转向。"
    }
  ],
  "assessment_note": "按作品中可观察的过程逐项反馈。数值结果、关系解释、记录与修订分别评价；不以画面精美程度或一次自评判定掌握。",
  "teacher_notes": "实地版本须由教师选择适宜地点；纸面任务已可完整实施。此处最短结论仅限沿方格线行走，不声称折线路程是任意平面路径的最短距离。",
  "author_type": "ai",
  "review_status": "draft",
  "teacher_review": {
    "status": "pending"
  }
}
